{
  "case_id": "VE-METHOD-001-SECRET",
  "method_id": "VE-METHOD-001",
  "method_version": "0.1.0",
  "title": "Fixture does not see the parent secret",
  "claim": "参考 runner 不会把 VE_TEST_SECRET 传给 fixture。",
  "testable_statement": "运行 fixtures/secret_probe/tool.py。父进程即使持有 VE_TEST_SECRET，stdout 仍为 clean，退出码为 0。",
  "fixture_id": "FIX-SECRET-001",
  "component_path": "fixtures/component.json",
  "entrypoint": "fixtures/secret_probe/tool.py",
  "input_file": "fixtures/input.txt",
  "expected_exit_code": 0,
  "expected_stdout_file": "fixtures/secret_probe/expected.txt",
  "timeout_seconds": 5
}
